2;CENTRO UNIVERSITÁRIO DE VOTUPORANGA;VOTUPORANGA;NA;NELSON THOMÉ SERAPHIM JÚNIOR;(17)34059999;ate@fev.edu.br;Rua Pernambuco 4196 Terreo;0;0;0;2;Votuporanga;38;0;0;5.482;4.092;0;0;1.390;0;0;227;234;USD;0;0;152.838.619.926.827;NA;www.unifev.edu.br/2;CENTRO UNIVERSITÁRIO CENTRAL PAULISTA;SAO CARLOS;NA;MARCELLO APARECIDO IENCO (DIRETOR ADMINISTRADOR) ;(16)33622111;milani@unicep.com.br;Rua Pedro Bianchi 111 ;1;0;0;2;Sao Carlos;28;0;0;5.463;4.206;0;0;1.257;0;0;197;109;USD;0;0;143.400.096.996.512;NA;www.unicep.edu.br/2;Centro Universitário - Católica de Santa Catarina em Jaraguá do Sul;JARAGUA DO SUL;NA;  FREDERICO UNTERBERGER (PRESIDENTE) ;(47)32758245 ;reitoria@catolicasc.org.br ;"Rua dos Imigrantes  Nº:  500 CEP:  89254-430 ";0;0;0;1;NA;17;0;0;3.625;2.792;0;0;833;0;0;195;92;USD;0;0;139.876.110.780.226;NA;www.catolicasc.org.br/2;Centro Universitário - Católica de Santa Catarina em Joinville;JOINVILLE;NA;  FREDERICO UNTERBERGER (PRESIDENTE) ;(47)31459700 ;reitoria@catolicasc.org.br;Rua Senador Felipe Schmidt  Nº:  S/N  CEP:  89201-440;0;0;0;1;NA;13;0;0;1.462;832;0;0;630;0;0;110;29;USD;0;0;139.876.110.780.226;NA;www.catolicasc.org.br/2;CENTRO UNIVERSITÁRIO DE GOIÁS;GOIANIA;Prof. Dr Joveny Sebastião Cândido de Oliveira;NA;(62)32461434;anhanguera@anhanguera.edu.br;Rua Professor Lázaro Costa 456 ;0;0;0;1;NA;30;0;0;8.828;6.928;0;0;1.900;0;0;204;95;USD;0;0;137.700.497.745.257;NA;anhanguera.edu.br/2;UNIVERSIDADE CATÓLICA DE PETRÓPOLIS;PETROPOLIS;NA;  LEOZÍRIO PAIXÃO NETO;(24)22444000;reitor@ucp.br;Rua Benjamin Constant 213 ;0;0;0;2;Petrópilis;36;0;0;4.931;3.828;101;0;1.002;0;0;203;208;USD;0;0;135.532.342.380.669;NA;www.ucp.br/2;CENTRO UNIVERSITÁRIO DE FORMIGA;FORMIGA;NA;  MARCO ANTONIO DE SOUSA LEÃO;(37)33291400;uniformg@uniformg.edu.br;Avenida Doutor Arnaldo de Senna 328 ;0;0;0;1;NA;24;0;0;3.829;2.790;0;0;1.039;0;0;179;195;USD;0;0;133.494.255.083.808;NA;www.uniformg.edu.br/2;UNIVERSIDADE IBIRAPUERA;SAO PAULO;NA;  JOSE CAMPOS DE ANDRADE;(11)50911193;nucai@ibirapuera.br;Avenida Iraí 297 ;0;0;0;2;Saao Paulo;31;0;0;3.972;2.712;17;0;1.243;0;0;189;82;USD;0;0;131.802.736.322.641;NA;www.ibirapuera.br/2;CENTRO UNIVERSITÁRIO DO RIO GRANDE DO NORTE;NATAL;NA;MANOEL DE MEDEIROS BRITO (PRESIDENTE DA MANTENEDORA);(84)32152917;unirn@unirn.edu.br;Rua Prefeita Eliane Barros  Nº:  2000 CEP:  59014-540 ;0;0;0;1;NA;14;0;0;5.289;3.954;0;0;1.335;0;0;181;107;USD;0;0;123.920.840.636.433;NA;www.unirn.edu.br/2;CENTRO UNIVERSITÁRIO SÃO CAMILO - ESPÍRITO SANTO;CACHOEIRO DE ITAPEMIRIM;NA;  CARLOS FERRARA JUNIOR (DIRETOR GERAL DE ENSINO) ;(28)35265911;danielafiorini@saocamilo-es.br;Rua São Camilo de Lellis 1 ;0;0;0;2;Cachoeiro de Itapemirim;22;0;0;4.612;3.773;0;0;839;0;0;121;421;USD;0;0;11.922.110.865.311;NA;www.saocamilo-es.br/centrouniversitario2;CENTRO UNIVERSITÁRIO MOACYR SREDER BASTOS;RIO DE JANEIRO;NA;STHEFANO BRUNO PINTO DA COSTA;(21)24135727;praa@msb.br;Rua Engenheiro Trindade 229 ;0;0;0;4;Rio de Janeiro;31;0;0;6.685;4.204;0;0;2.481;0;0;154;133;USD;0;0;116.012.717.604.016;NA;www.msb.br/2;ABEU - CENTRO UNIVERSITÁRIO;BELFORD ROXO;Valdir Vilela ;  PAULO ROBERTO DE MENEZES CHAVES (DIRETOR) ;(21)21040460;prmc@abeu.com.br ;Rua Itaiara 301 ;0;0;0;6;Angra dos Reis-Belford Roxo-Nilópolis-Nova Iguaçu-Rio de Janeiro;23;0;0;8.917;6.523;0;0;2.394;0;0;287;384;USD;0;0;113.886.329.447.801;NA;www.uniabeu.edu.br/2;CENTRO UNIVERSITÁRIO HERMÍNIO DA SILVEIRA;RIO DE JANEIRO;NA;  SERGIO LUIZ VASQUEZ MACHADO (DIRETOR GERAL DA MANTENEDORA - IBMR) ;(21)25598601;ibmr@ibmr.br;Praia de Botafogo 158 ;1;0;0;3;Rio de Janeiro;28;0;0;6.865;4.395;0;0;2.470;0;0;230;110;USD;0;0;112.429.107.461.925;NA;www.ibmr.br/2;UNIVERSIDADE DE CRUZ ALTA;CRUZ ALTA;NA;  ENEDINA MARIA TEIXEIRA DA SILVA;(55)33211739;reitoria@unicruz.edu.br;Rua Andrade Neves 308 ;0;0;0;2;Cruz Alta;25;0;0;3.100;2.346;14;0;740;0;0;163;227;USD;0;0;111.709.387.390.453;NA;www.unicruz.edu.br/2;CENTRO UNIVERSITÁRIO CATÓLICO SALESIANO AUXILIUM;LINS;Pe. Luigi Favero;  GILDASIO MENDES DOS SANTOS;(14)35336200;academico@unisalesiano.edu.br;Rua Dom Bosco 265 ;0;0;0;2;NA;44;0;0;7.247;6.031;0;0;1.216;0;0;258;184;USD;0;0;111.692.347.485.748;NA;www.unisalesiano.edu.br/2;CENTRO UNIVERSITÁRIO EURÍPEDES DE MARÍLIA;MARILIA;LUIZ CARLOS DE MACEDO SOARES;NA;(14)21050833;fundacao@univem.edu.br;Avenida Higyno Muzzy Filho 529 ;0;0;0;1;Marília;10;0;0;3.261;2.494;0;0;767;0;0;116;213;USD;0;0;108.786.470.688.335;NA;www.univem.edu.br/2;Centro Universitário Dinâmica das Cataratas;FOZ DO IGUACU;NA;ROSICLER HAUAGGE DO PRADO (DIRETORA PRESIDENTE);(45)35236900;angela@udc.edu.br;Rua Castelo Branco  Nº:  349 CEP:  85852-010 ;1;0;0;6;Cascavel-Foz do Iguaçu-Guarapuava-Medianeira ;20;0;5;6.107;4.526;0;0;1.581;0;0;255;80;USD;0;0;107.704.179.358.462;NA;www.udc.edu.br/2;CENTRO UNIVERSITÁRIO GERALDO DI BIASE;VOLTA REDONDA;  GERALDO DI BIASE FILHO ;NA;(24)33451708;reitoria@ugb.edu.br;Rua Deputado Geraldo Di Biase 81 ;0;0;0;4;Barra do Piraí-Nova Iguaçu-Volta Redonda ;32;0;0;6.506;4.643;0;0;1.863;0;0;299;341;USD;0;0;104.631.946.737.003;NA;www.ferp.br/2;CENTRO UNIVERSITÁRIO FUNDAÇÃO DE ENSINO OCTÁVIO BASTOS - FEOB;SAO JOAO DA BOA VISTA;JOÃO OTÁVIO BASTOS JUNQUEIRA;NA;(19)36343328;geralsecret@unifeob.edu.br;Rua General Osório 433 Sede;0;0;0;3;  São João da Boa Vista;27;0;0;5.460;3.442;0;0;2.018;0;0;168;178;USD;0;0;102.900.544.541.819;NA;unifeob.edu.br/